{
  "format": "fieldweft",
  "version": 1,
  "entities": [
    {
      "id": "entity",
      "name": "Entity",
      "kind": "db",
      "description": "Canonical fixture",
      "tags": [
        "A",
        "z"
      ],
      "meta": {
        "10": "ten",
        "2": "two",
        "codeWithLeadingZero": "00123",
        "exactDecimal": "1234567890.1234567890",
        "longId": "9223372036854775807",
        "threshold": 0.000001,
        "😀": "supplementary",
        "": "bmp"
      },
      "position": {
        "x": 0,
        "y": 0
      },
      "fields": [
        {
          "id": "2",
          "name": "second",
          "type": "string",
          "discriminator": {
            "values": [
              "A"
            ]
          }
        },
        {
          "id": "10",
          "name": "tenth",
          "type": "string",
          "discriminator": {
            "values": [
              "B"
            ]
          }
        },
        {
          "id": "value",
          "name": "value",
          "type": "string",
          "description": "conditional",
          "when": {
            "10": [
              "B"
            ],
            "2": [
              "A"
            ]
          }
        }
      ]
    }
  ],
  "processes": [],
  "boundaries": [],
  "nodeRelations": [],
  "mappings": []
}
